{
  "input_options": {
    "ss": "00:10:00",
    "to": "00:11:00"
  },
  "sources": [
    "source_file_1.mkv",
    "source_file_2.ac3"
  ],
  "source_maps": [
    {
      "source": 0,
      "specifier": "v",
      "stream": 0
    },
    {
      "source": 1,
      "specifier": "a",
      "stream": 0
    },
    {
      "source": 0,
      "specifier": "s",
      "stream": 0
    }
  ],
  "output_maps": [
    {
      "specifier": "v",
      "stream": 0,
      "options": {
        "codec": "libx265",
        "crf": 19,
        "pix_fmt": "yuv420p10le",
        "preset": "slow",
        "x265-params": {
          "limit-sao": 1,
          "bframes": 8,
          "psy-rd": 1,
          "psy-rdoq": 2,
          "aq-mode": 3
        }
      }
    },
    {
      "specifier": "a",
      "stream": 0,
      "options": {
        "codec": "libopus",
        "b": "128k",
        "ac": 2,
        "vbr": "on",
        "compression_level": 10,
        "frame_duration": 60,
        "application": "audio"
      }
    },
    {
      "specifier": "s",
      "stream": 0,
      "options": {
        "codec": "copy"
      }
    }
  ],
  "output_file": "/shared/output_file.mkv"
}